{
  "version": "2.0",
  "report_date": "2026-09-14",
  "customer": {
    "name": "홍길동",
    "birth_date": "1981-05-12",
    "age": 45,
    "sex": "남"
  },
  "health": {
    "records": [
      {
        "record_key": "GENERAL-2026",
        "provider": "국민건강보험공단",
        "checkup_date": "2026-08-21",
        "institution": "예시검진의원",
        "source_ref": "건강검진결과.pdf p.1-3"
      }
    ],
    "metrics": [
      {
        "metric_key": "BMI",
        "name": "체질량지수",
        "short_name": "BMI",
        "value": 26.1,
        "unit": "kg/m²",
        "reference": "18.5-24.9",
        "comment": "체중 관리 권고",
        "state": "watch",
        "areas": ["weight"],
        "featured": true,
        "source_ref": "건강검진결과.pdf p.2",
        "record_key": "GENERAL-2026"
      },
      {
        "metric_key": "GLUCOSE",
        "name": "공복혈당",
        "value": 112,
        "unit": "mg/dL",
        "reference": "70-99",
        "comment": "추적 관리 권고",
        "state": "watch",
        "areas": ["glucose"],
        "featured": true,
        "source_ref": "건강검진결과.pdf p.2",
        "record_key": "GENERAL-2026"
      },
      {
        "metric_key": "BP",
        "name": "혈압",
        "value": "132/84",
        "unit": "mmHg",
        "reference": null,
        "comment": "생활습관 관리",
        "state": "watch",
        "areas": ["pressure"],
        "featured": true,
        "source_ref": "건강검진결과.pdf p.1",
        "record_key": "GENERAL-2026"
      },
      {
        "metric_key": "ALT",
        "name": "ALT",
        "value": 29,
        "unit": "U/L",
        "reference": "0-35",
        "comment": null,
        "state": "good",
        "areas": ["liver"],
        "featured": false,
        "source_ref": "건강검진결과.pdf p.2",
        "record_key": "GENERAL-2026"
      }
    ],
    "area_notes": []
  },
  "insurance": {
    "source_label": "메리츠 보장분석",
    "as_of_date": "2026-09-14",
    "source_complete": true,
    "provider_type": "MERITZ_REPORT",
    "coverages": [
      {
        "source_entry_key": "M-001",
        "policy_key": "POLICY-01",
        "company": "A손해보험",
        "product": "건강보험 예시",
        "source_group": "암 > 진단비",
        "rider_name": "일반암 진단비",
        "amount_won": 30000000,
        "amount_basis": "가입금액",
        "payment_type": "fixed_amount",
        "coverage_id": "C010",
        "insured": "self",
        "source_ref": "보장분석.pdf p.4"
      },
      {
        "source_entry_key": "M-002",
        "policy_key": "POLICY-01",
        "company": "A손해보험",
        "product": "건강보험 예시",
        "source_group": "뇌 > 진단비",
        "rider_name": "뇌혈관질환진단비",
        "amount_won": 10000000,
        "amount_basis": "가입금액",
        "payment_type": "fixed_amount",
        "coverage_id": "C038",
        "insured": "self",
        "source_ref": "보장분석.pdf p.5"
      },
      {
        "source_entry_key": "M-003",
        "policy_key": "POLICY-02",
        "company": "B생명",
        "product": "CI보험 예시",
        "source_group": "기타",
        "rider_name": "중대한질병추가보장",
        "amount_won": 20000000,
        "amount_basis": "가입금액",
        "payment_type": "conditional",
        "coverage_id": null,
        "insured": "self",
        "source_ref": "보장분석.pdf p.9"
      }
    ]
  },
  "standards": [],
  "issues": []
}
